{
  "specification_id": "SPEC-VENDOR-WRITE-001",
  "title": "Ambiguous vendor write reconciliation",
  "version": "0.1.0",
  "intent": "Every external write reaches one scientifically coherent outcome across timeout and retry conditions.",
  "material_effect": "Laboratory teams receive one authoritative record while reconciliation preserves throughput and auditability.",
  "intended_use_profile": "Research-use specimen lifecycle projection",
  "rules": [
    {
      "rule_id": "RULE-STABLE-IDENTITY-001",
      "desired_state": "Every vendor write carries a stable external request identity and an immutable canonical payload digest.",
      "verification": "The conformance run reads the vendor state by stable identity and reconciles its payload digest before each retry."
    },
    {
      "rule_id": "RULE-RECONCILIATION-001",
      "desired_state": "A timeout activates readback and reconciliation before the worker chooses commit completion or a bounded retry.",
      "verification": "Injected pre-commit and post-commit timeouts produce one vendor effect and one closed reconciliation record."
    }
  ],
  "scenario_ids": [
    "SCENARIO-AMBIGUOUS-WRITE-001"
  ],
  "acceptance_authorities": [
    "scientific",
    "quality",
    "regulatory",
    "operations"
  ],
  "metadata": {
    "schema_version": "2.1.0",
    "created_at": "2026-07-28T14:05:00Z",
    "updated_at": "2026-07-28T14:05:00Z",
    "owner": {
      "actor_id": "OWNER-SPEC-001",
      "display_name": "Program Specification Lead",
      "role": "Program owner",
      "organization": "Example Laboratory"
    }
  }
}
